<?xml version="1.0" encoding="UTF-8" ?>
<tableStats xmlns="https://github.com/tddl/tddl/schema/stat" xmlns:xsi="http://www.w3.org/2001/XMLSchema-instance"
    xsi:schemaLocation="https://github.com/tddl/tddl/schema/stat https://raw.github.com/tddl/tddl/master/tddl-common/src/main/resources/META-INF/stat.xsd">
	<tableStat>
		<tableName>TABLE1</tableName>
		<tableRows>1000</tableRows>
	</tableStat>
	<tableStat>
		<tableName>TABLE2</tableName>
		<tableRows>100000</tableRows>
	</tableStat>
	<tableStat>
		<tableName>TABLE3</tableName>
		<tableRows>999</tableRows>
	</tableStat>
</tableStats>